{
  "analysis_id": "analysis_ai_agent_practicalization_v1",
  "case_id": "ai_agent_practicalization",
  "contract_version": "2026-03-24.v1",
  "bucket_granularity": "day",
  "generated_at": "2026-03-24T12:30:00Z",
  "raw_comments": [
    {
      "raw_comment_id": "raw_001",
      "platform": "bilibili",
      "source_item_id": "video_agent_001",
      "source_comment_id": "cmt_001",
      "author_handle": "ops_builder",
      "text": "真正能落地的 AI Agent 不是全自动，而是先把重复流程半自动化。",
      "created_at": "2026-03-10T09:00:00Z",
      "collected_at": "2026-03-24T09:30:00Z",
      "engagement": { "like_count": 42, "reply_count": 5, "share_count": 2 },
      "metadata": { "source_url": "https://example.com/bilibili/video_agent_001#cmt_001" }
    },
    {
      "raw_comment_id": "raw_002",
      "platform": "bilibili",
      "source_item_id": "video_agent_001",
      "source_comment_id": "cmt_002",
      "author_handle": "crm_ops",
      "text": "Agent 一接 CRM 和工单系统，运营效率就上来了。",
      "created_at": "2026-03-11T10:00:00Z",
      "collected_at": "2026-03-24T09:30:00Z",
      "engagement": { "like_count": 58, "reply_count": 8, "share_count": 3 },
      "metadata": { "source_url": "https://example.com/bilibili/video_agent_001#cmt_002" }
    },
    {
      "raw_comment_id": "raw_003",
      "platform": "xiaohongshu",
      "source_item_id": "post_agent_014",
      "source_comment_id": "cmt_003",
      "author_handle": "infra_watch",
      "text": "现在最大问题不是模型不够强，是部署和维护成本太高。",
      "created_at": "2026-03-12T14:00:00Z",
      "collected_at": "2026-03-24T09:30:00Z",
      "engagement": { "like_count": 27, "reply_count": 6, "share_count": 2 },
      "metadata": { "source_url": "https://example.com/xiaohongshu/post_agent_014#cmt_003" }
    }
  ],
  "normalized_comments": [
    {
      "comment_id": "norm_001",
      "raw_comment_id": "raw_001",
      "platform": "bilibili",
      "source_item_id": "video_agent_001",
      "source_comment_id": "cmt_001",
      "canonical_text": "真正能落地的 AI Agent 不是全自动，而是先把重复流程半自动化。",
      "normalized_text": "真正能落地的 ai agent 不是全自动 而是先把重复流程半自动化",
      "language": "zh-CN",
      "source_class": "practitioner",
      "quality_score": 0.88,
      "noise_flags": [],
      "dedupe_key": "dup_ai_agent_001",
      "created_at": "2026-03-10T09:00:00Z",
      "collected_at": "2026-03-24T09:30:00Z",
      "topic_tags": ["ai_agent_practicalization", "workflow_automation"],
      "metadata": { "normalizer_version": "deterministic-v1" }
    },
    {
      "comment_id": "norm_002",
      "raw_comment_id": "raw_002",
      "platform": "bilibili",
      "source_item_id": "video_agent_001",
      "source_comment_id": "cmt_002",
      "canonical_text": "Agent 一接 CRM 和工单系统，运营效率就上来了。",
      "normalized_text": "agent 一接 crm 和工单系统 运营效率就上来了",
      "language": "zh-CN",
      "source_class": "practitioner",
      "quality_score": 0.91,
      "noise_flags": [],
      "dedupe_key": "dup_ai_agent_002",
      "created_at": "2026-03-11T10:00:00Z",
      "collected_at": "2026-03-24T09:30:00Z",
      "topic_tags": ["ai_agent_practicalization", "system_integration"],
      "metadata": { "normalizer_version": "deterministic-v1" }
    },
    {
      "comment_id": "norm_003",
      "raw_comment_id": "raw_003",
      "platform": "xiaohongshu",
      "source_item_id": "post_agent_014",
      "source_comment_id": "cmt_003",
      "canonical_text": "现在最大问题不是模型不够强，是部署和维护成本太高。",
      "normalized_text": "现在最大问题不是模型不够强 是部署和维护成本太高",
      "language": "zh-CN",
      "source_class": "practitioner",
      "quality_score": 0.87,
      "noise_flags": [],
      "dedupe_key": "dup_ai_agent_003",
      "created_at": "2026-03-12T14:00:00Z",
      "collected_at": "2026-03-24T09:30:00Z",
      "topic_tags": ["ai_agent_practicalization", "cost_operations"],
      "metadata": { "normalizer_version": "deterministic-v1" }
    }
  ],
  "claim_candidate_spans": [
    {
      "span_id": "span_001",
      "comment_id": "norm_001",
      "text": "真正能落地的 AI Agent 不是全自动，而是先把重复流程半自动化。",
      "start_char": 0,
      "end_char": 31,
      "heuristic_labels": ["assertion", "workflow"],
      "candidate_score": 0.93,
      "metadata": { "generator": "heuristic-v1" }
    },
    {
      "span_id": "span_002",
      "comment_id": "norm_002",
      "text": "Agent 一接 CRM 和工单系统，运营效率就上来了。",
      "start_char": 0,
      "end_char": 27,
      "heuristic_labels": ["assertion", "integration"],
      "candidate_score": 0.95,
      "metadata": { "generator": "heuristic-v1" }
    },
    {
      "span_id": "span_003",
      "comment_id": "norm_003",
      "text": "现在最大问题不是模型不够强，是部署和维护成本太高。",
      "start_char": 0,
      "end_char": 28,
      "heuristic_labels": ["assertion", "cost"],
      "candidate_score": 0.94,
      "metadata": { "generator": "heuristic-v1" }
    }
  ],
  "claims": [
    {
      "claim_id": "claim_001",
      "comment_id": "norm_001",
      "span_id": "span_001",
      "text": "AI Agent 更适合先做半自动流程，而不是追求全自动替代。",
      "evidence_text": "真正能落地的 AI Agent 不是全自动，而是先把重复流程半自动化。",
      "evidence_start": 0,
      "evidence_end": 31,
      "created_at": "2026-03-24T12:00:00Z",
      "extractor": {
        "provider": "openai",
        "model": "gpt-5-mini",
        "prompt_version": "claims.v1",
        "run_id": "run_claims_001"
      },
      "extractor_confidence": 0.94,
      "stance": "support",
      "topic_tags": ["ai_agent_practicalization", "workflow_automation"],
      "source_class": "practitioner",
      "signal_strength": 0.86,
      "llm_audit_id": "audit_claims_001",
      "metadata": {}
    },
    {
      "claim_id": "claim_002",
      "comment_id": "norm_002",
      "span_id": "span_002",
      "text": "当 Agent 接入 CRM 和工单系统时，会显著提升运营效率。",
      "evidence_text": "Agent 一接 CRM 和工单系统，运营效率就上来了。",
      "evidence_start": 0,
      "evidence_end": 27,
      "created_at": "2026-03-24T12:00:00Z",
      "extractor": {
        "provider": "openai",
        "model": "gpt-5-mini",
        "prompt_version": "claims.v1",
        "run_id": "run_claims_001"
      },
      "extractor_confidence": 0.95,
      "stance": "support",
      "topic_tags": ["ai_agent_practicalization", "system_integration"],
      "source_class": "practitioner",
      "signal_strength": 0.93,
      "llm_audit_id": "audit_claims_001",
      "metadata": {}
    },
    {
      "claim_id": "claim_003",
      "comment_id": "norm_003",
      "span_id": "span_003",
      "text": "部署和维护成本是当前 AI Agent 落地的主要障碍。",
      "evidence_text": "现在最大问题不是模型不够强，是部署和维护成本太高。",
      "evidence_start": 0,
      "evidence_end": 28,
      "created_at": "2026-03-24T12:00:00Z",
      "extractor": {
        "provider": "openai",
        "model": "gpt-5-mini",
        "prompt_version": "claims.v1",
        "run_id": "run_claims_001"
      },
      "extractor_confidence": 0.96,
      "stance": "observe",
      "topic_tags": ["ai_agent_practicalization", "cost_operations"],
      "source_class": "practitioner",
      "signal_strength": 0.89,
      "llm_audit_id": "audit_claims_001",
      "metadata": {}
    }
  ],
  "viewpoints": [
    {
      "viewpoint_id": "vp_001",
      "topic_tag": "pragmatic_adoption",
      "viewpoint_label": "工作流与集成落地",
      "title": "务实场景中的工作流和系统集成让 Agent 变得可用",
      "claim_statement": "AI Agent 的可落地价值主要来自半自动工作流和业务系统集成。",
      "summary": "讨论把 Agent 的真实价值定位为工作流编排和系统集成，而不是全自动通用代理。",
      "summary_source": "llm",
      "summary_grounding_score": 0.92,
      "claim_ids": ["claim_001", "claim_002"],
      "comment_ids": ["norm_001", "norm_002"],
      "representative_claim_ids": ["claim_001", "claim_002"],
      "evidence_comment_ids": ["norm_001", "norm_002"],
      "support_count": 2,
      "unique_comment_count": 2,
      "keywords": ["workflow", "integration", "pragmatic"],
      "metadata": {}
    },
    {
      "viewpoint_id": "vp_002",
      "topic_tag": "deployment_friction",
      "viewpoint_label": "成本与运维摩擦",
      "title": "部署和维护成本继续拖慢 Agent 扩张",
      "claim_statement": "部署与维护成本是当前 AI Agent 规模化落地的主要阻力。",
      "summary": "即使落地路径更清晰，部署与维护压力仍然抑制了 Agent 的扩张速度。",
      "summary_source": "llm",
      "summary_grounding_score": 0.89,
      "claim_ids": ["claim_003"],
      "comment_ids": ["norm_003"],
      "representative_claim_ids": ["claim_003"],
      "evidence_comment_ids": ["norm_003"],
      "support_count": 1,
      "unique_comment_count": 1,
      "keywords": ["cost", "maintenance", "friction"],
      "metadata": {}
    }
  ],
  "viewpoint_snapshots": [
    {
      "snapshot_id": "vp_snap_001",
      "viewpoint_id": "vp_001",
      "bucket_index": 0,
      "bucket_start": "2026-03-10",
      "bucket_granularity": "day",
      "support_count": 1,
      "unique_comment_count": 1,
      "heat_index": 47,
      "representative_claim_ids": ["claim_001"],
      "metadata": {}
    },
    {
      "snapshot_id": "vp_snap_002",
      "viewpoint_id": "vp_001",
      "bucket_index": 1,
      "bucket_start": "2026-03-11",
      "bucket_granularity": "day",
      "support_count": 2,
      "unique_comment_count": 2,
      "heat_index": 64,
      "representative_claim_ids": ["claim_001", "claim_002"],
      "metadata": {}
    },
    {
      "snapshot_id": "vp_snap_003",
      "viewpoint_id": "vp_002",
      "bucket_index": 2,
      "bucket_start": "2026-03-12",
      "bucket_granularity": "day",
      "support_count": 1,
      "unique_comment_count": 1,
      "heat_index": 52,
      "representative_claim_ids": ["claim_003"],
      "metadata": {}
    }
  ],
  "viewpoint_relations": [
    {
      "relation_id": "vp_rel_001",
      "source_viewpoint_id": "vp_002",
      "target_viewpoint_id": "vp_001",
      "relation_type": "constrains",
      "weight": 0.66,
      "evidence_claim_ids": ["claim_003"],
      "rationale": "成本摩擦限制工作流与集成价值的扩张速度。",
      "metadata": {}
    }
  ],
  "storylines": [
    {
      "storyline_id": "st_001",
      "topic_tag": "ai_agent_practicalization",
      "storyline_label": "务实落地线",
      "title": "AI Agent 正向工作流与系统集成落地收敛",
      "summary": "围绕 Agent 的有效叙事开始转向工作流编排和业务系统集成。",